{
  "name": "Dev' Tutorial Test",
  "resume": "Not interesting",
  "slug": "dev5",
  "icon": "https://www.stickpng.com/assets/images/5847f981cef1014c0b5e48be.png",
  "description": "Lorem ipsum dolor sit amet, consectetur adipiscing elit. Pellentesque sit amet varius elit. Ut blandit congue faucibus. Mauris hendrerit enim eu magna vehicula, vitae vulputate risus vehicula. Donec ac nisl nec diam molestie rutrum in vel ligula. Phasellus tempus eros et ante accumsan cursus. Sed.",
  "slides": []
}
