{
  "name": "Dev' Tutorial Test",
  "resume": "Not interesting",
  "slug": "dev7",
  "icon": "https://www.stickpng.com/assets/images/5847f981cef1014c0b5e48be.png",
  "description": "Phasellus elit leo, sodales in arcu ut, pulvinar tempor lorem. Nam et lacus urna. Quisque id purus vestibulum, fringilla ante eget, dictum orci. Vivamus sollicitudin nisl ut blandit interdum. Aenean eget neque et neque hendrerit finibus ac ut erat. Etiam sodales convallis eros, vitae tempor erat blandit non. Etiam id auctor augue.",
  "slides": []
}
