{
  "name": "Dev' Tutorial Test",
  "resume": "Not interesting (don't try it...)",
  "slug": "dev3",
  "icon": "https://www.stickpng.com/assets/images/5847f981cef1014c0b5e48be.png",
  "description": "Lorem ipsum dolor sit amet, consectetur adipiscing elit. Maecenas a nisi rhoncus, porta est in, ornare felis. Donec ut elit ac nibh pharetra facilisis. Pellentesque enim mi, vehicula id diam ut, euismod luctus magna. Suspendisse blandit turpis ut mi varius egestas in nec lorem. Nulla facilisis, metus quis interdum cursus, diam justo pharetra sem, non semper nulla massa eget arcu. Suspendisse quis risus aliquet, accumsan lorem a, fermentum tellus. Vivamus viverra ex ut molestie pellentesque. Praesent imperdiet finibus enim vel interdum.",
  "slides": []
}
